{
  "fixture_id": "08-close-and-reopen-position",
  "case_number": 8,
  "title": "Full close zeros cost; reopen preserves historical PnL",
  "synthetic_data": true,
  "related_rules": [
    "INV-007",
    "INV-008"
  ],
  "related_adrs": [
    "ADR-0004",
    "ADR-0005"
  ],
  "coverage": {
    "normal": {
      "scenario_ids": [
        "normal"
      ],
      "rule_ids": [
        "INV-007",
        "INV-008"
      ]
    },
    "boundary": {
      "scenario_ids": [
        "boundary"
      ],
      "rule_ids": [
        "INV-007",
        "INV-008"
      ]
    },
    "failure": {
      "scenario_ids": [
        "failure"
      ],
      "rule_ids": [
        "INV-007",
        "INV-008"
      ]
    }
  },
  "decimal_contract": {
    "id": "decimal-contract-v1",
    "max_significant_digits": 28,
    "max_scale": {
      "amount": 8,
      "quantity": 12,
      "unit_price": 12,
      "fx_rate": 15,
      "internal": 18
    }
  },
  "calculation_version": "ledger-calculation-v1",
  "policy_versions": {
    "expense": "expense-policy-v1",
    "bucket": "expense-bucket-policy-v1",
    "refund": "refund-policy-v1",
    "market_data": "market-data-policy-v1"
  },
  "rounding_boundaries": [
    "internal-scale-18-half-up",
    "display-currency-half-up"
  ],
  "tolerances": {
    "internal": "0",
    "display": "0.01"
  },
  "generation": {
    "method": "programmatically-generated-synthetic-data",
    "generator": "tools/generate-m0-fixtures.mjs",
    "reviewed": true
  },
  "canonical_hash": "sha256:8fab33150cda22b25281353f5eb6aada01a839d4b75dadc8b0b1fc3617922597"
}
