{
  "fixture_id": "31-expense-excel-difference-bridge",
  "case_number": 31,
  "title": "Excel-visible and application expense policies reconcile by event",
  "synthetic_data": true,
  "related_rules": [
    "EXP-001",
    "EXP-004",
    "EXP-005",
    "EXP-006",
    "EXP-007",
    "EXP-012",
    "MIG-006"
  ],
  "related_adrs": [
    "ADR-0011",
    "ADR-0014"
  ],
  "coverage": {
    "normal": {
      "scenario_ids": [
        "normal"
      ],
      "rule_ids": [
        "EXP-001",
        "EXP-004",
        "EXP-005",
        "EXP-006",
        "EXP-007",
        "EXP-012",
        "MIG-006"
      ]
    },
    "boundary": {
      "scenario_ids": [
        "boundary"
      ],
      "rule_ids": [
        "EXP-001",
        "EXP-004",
        "EXP-005",
        "EXP-006",
        "EXP-007",
        "EXP-012",
        "MIG-006"
      ]
    },
    "failure": {
      "scenario_ids": [
        "failure"
      ],
      "rule_ids": [
        "EXP-001",
        "EXP-004",
        "EXP-005",
        "EXP-006",
        "EXP-007",
        "EXP-012",
        "MIG-006"
      ]
    }
  },
  "decimal_contract": {
    "id": "decimal-contract-v1",
    "max_significant_digits": 28,
    "max_scale": {
      "amount": 8,
      "quantity": 12,
      "unit_price": 12,
      "fx_rate": 15,
      "internal": 18
    }
  },
  "calculation_version": "ledger-calculation-v1",
  "policy_versions": {
    "expense": "expense-policy-v1",
    "bucket": "expense-bucket-policy-v1",
    "refund": "refund-policy-v1",
    "market_data": "market-data-policy-v1"
  },
  "rounding_boundaries": [
    "internal-scale-18-half-up",
    "display-currency-half-up"
  ],
  "tolerances": {
    "internal": "0",
    "display": "0.01"
  },
  "generation": {
    "method": "programmatically-generated-synthetic-data",
    "generator": "tools/generate-m0-fixtures.mjs",
    "reviewed": true
  },
  "canonical_hash": "sha256:541dffea1cd572424cc37210598873ca41de3d6374a8047ab77e23931d30d851"
}
