{
  "fixture_id": "25-category-lifecycle",
  "case_number": 25,
  "title": "Category lifecycle preserves stable historical identity",
  "synthetic_data": true,
  "related_rules": [
    "EXP-006",
    "EXP-011"
  ],
  "related_adrs": [
    "ADR-0014"
  ],
  "coverage": {
    "normal": {
      "scenario_ids": [
        "normal"
      ],
      "rule_ids": [
        "EXP-006",
        "EXP-011"
      ]
    },
    "boundary": {
      "scenario_ids": [
        "boundary"
      ],
      "rule_ids": [
        "EXP-006",
        "EXP-011"
      ]
    },
    "failure": {
      "scenario_ids": [
        "failure"
      ],
      "rule_ids": [
        "EXP-006",
        "EXP-011"
      ]
    }
  },
  "decimal_contract": {
    "id": "decimal-contract-v1",
    "max_significant_digits": 28,
    "max_scale": {
      "amount": 8,
      "quantity": 12,
      "unit_price": 12,
      "fx_rate": 15,
      "internal": 18
    }
  },
  "calculation_version": "ledger-calculation-v1",
  "policy_versions": {
    "expense": "expense-policy-v1",
    "bucket": "expense-bucket-policy-v1",
    "refund": "refund-policy-v1",
    "market_data": "market-data-policy-v1"
  },
  "rounding_boundaries": [
    "internal-scale-18-half-up",
    "display-currency-half-up"
  ],
  "tolerances": {
    "internal": "0",
    "display": "0.01"
  },
  "generation": {
    "method": "programmatically-generated-synthetic-data",
    "generator": "tools/generate-m0-fixtures.mjs",
    "reviewed": true
  },
  "canonical_hash": "sha256:5e6c776f0eae6227ea9fdf6dfb199b79bad79cc21715a79ad4b7fdd6637105ec"
}
