{
  "fixture_id": "30-canonical-row-order",
  "case_number": 30,
  "title": "Canonical query hash ignores physical row and import order",
  "synthetic_data": true,
  "related_rules": [
    "EVT-005",
    "EXP-008",
    "EXP-009",
    "EXP-012"
  ],
  "related_adrs": [
    "ADR-0003",
    "ADR-0014"
  ],
  "coverage": {
    "normal": {
      "scenario_ids": [
        "normal"
      ],
      "rule_ids": [
        "EVT-005",
        "EXP-008",
        "EXP-009",
        "EXP-012"
      ]
    },
    "boundary": {
      "scenario_ids": [
        "boundary"
      ],
      "rule_ids": [
        "EVT-005",
        "EXP-008",
        "EXP-009",
        "EXP-012"
      ]
    },
    "failure": {
      "scenario_ids": [
        "failure"
      ],
      "rule_ids": [
        "EVT-005",
        "EXP-008",
        "EXP-009",
        "EXP-012"
      ]
    }
  },
  "decimal_contract": {
    "id": "decimal-contract-v1",
    "max_significant_digits": 28,
    "max_scale": {
      "amount": 8,
      "quantity": 12,
      "unit_price": 12,
      "fx_rate": 15,
      "internal": 18
    }
  },
  "calculation_version": "ledger-calculation-v1",
  "policy_versions": {
    "expense": "expense-policy-v1",
    "bucket": "expense-bucket-policy-v1",
    "refund": "refund-policy-v1",
    "market_data": "market-data-policy-v1"
  },
  "rounding_boundaries": [
    "internal-scale-18-half-up",
    "display-currency-half-up"
  ],
  "tolerances": {
    "internal": "0",
    "display": "0.01"
  },
  "generation": {
    "method": "programmatically-generated-synthetic-data",
    "generator": "tools/generate-m0-fixtures.mjs",
    "reviewed": true
  },
  "canonical_hash": "sha256:cb44e1409c89e352759983341e8811f968f4f548ede4a076e5313e8170f29e44"
}
