{
  "fixture_id": "18-import-idempotency",
  "case_number": 18,
  "title": "Identical-byte import reruns are idempotent",
  "synthetic_data": true,
  "related_rules": [
    "MIG-001",
    "MIG-002",
    "MIG-003"
  ],
  "related_adrs": [
    "ADR-0011"
  ],
  "coverage": {
    "normal": {
      "scenario_ids": [
        "normal"
      ],
      "rule_ids": [
        "MIG-001",
        "MIG-002",
        "MIG-003"
      ]
    },
    "boundary": {
      "scenario_ids": [
        "boundary"
      ],
      "rule_ids": [
        "MIG-001",
        "MIG-002",
        "MIG-003"
      ]
    },
    "failure": {
      "scenario_ids": [
        "failure"
      ],
      "rule_ids": [
        "MIG-001",
        "MIG-002",
        "MIG-003"
      ]
    }
  },
  "decimal_contract": {
    "id": "decimal-contract-v1",
    "max_significant_digits": 28,
    "max_scale": {
      "amount": 8,
      "quantity": 12,
      "unit_price": 12,
      "fx_rate": 15,
      "internal": 18
    }
  },
  "calculation_version": "ledger-calculation-v1",
  "policy_versions": {
    "expense": "expense-policy-v1",
    "bucket": "expense-bucket-policy-v1",
    "refund": "refund-policy-v1",
    "market_data": "market-data-policy-v1"
  },
  "rounding_boundaries": [
    "internal-scale-18-half-up",
    "display-currency-half-up"
  ],
  "tolerances": {
    "internal": "0",
    "display": "0.01"
  },
  "generation": {
    "method": "programmatically-generated-synthetic-data",
    "generator": "tools/generate-m0-fixtures.mjs",
    "reviewed": true
  },
  "canonical_hash": "sha256:ee891362d5ea939e02c0393a524f0d9c7fca3df93d3b3ba9f5a7a7a7ab7702f7"
}
