{
  "fixture_id": "21-expense-date-validation",
  "case_number": 21,
  "title": "Expense dates include endpoints and invalid input clears stale results",
  "synthetic_data": true,
  "related_rules": [
    "DATE-002",
    "EXP-008",
    "EXP-009"
  ],
  "related_adrs": [
    "ADR-0014"
  ],
  "coverage": {
    "normal": {
      "scenario_ids": [
        "normal"
      ],
      "rule_ids": [
        "DATE-002",
        "EXP-008",
        "EXP-009"
      ]
    },
    "boundary": {
      "scenario_ids": [
        "boundary"
      ],
      "rule_ids": [
        "DATE-002",
        "EXP-008",
        "EXP-009"
      ]
    },
    "failure": {
      "scenario_ids": [
        "failure"
      ],
      "rule_ids": [
        "DATE-002",
        "EXP-008",
        "EXP-009"
      ]
    }
  },
  "decimal_contract": {
    "id": "decimal-contract-v1",
    "max_significant_digits": 28,
    "max_scale": {
      "amount": 8,
      "quantity": 12,
      "unit_price": 12,
      "fx_rate": 15,
      "internal": 18
    }
  },
  "calculation_version": "ledger-calculation-v1",
  "policy_versions": {
    "expense": "expense-policy-v1",
    "bucket": "expense-bucket-policy-v1",
    "refund": "refund-policy-v1",
    "market_data": "market-data-policy-v1"
  },
  "rounding_boundaries": [
    "internal-scale-18-half-up",
    "display-currency-half-up"
  ],
  "tolerances": {
    "internal": "0",
    "display": "0.01"
  },
  "generation": {
    "method": "programmatically-generated-synthetic-data",
    "generator": "tools/generate-m0-fixtures.mjs",
    "reviewed": true
  },
  "canonical_hash": "sha256:74b26a32981e4036631ee157d0f6a56b525533556f9aebefc9fac8cac40927bb"
}
