{
  "fixture_id": "29-revision-watermark",
  "case_number": 29,
  "title": "Revision watermarks and cross-period refunds remain reproducible",
  "synthetic_data": true,
  "related_rules": [
    "EVT-001",
    "EVT-005",
    "EVT-006",
    "EXP-005",
    "EXP-012"
  ],
  "related_adrs": [
    "ADR-0006",
    "ADR-0014"
  ],
  "coverage": {
    "normal": {
      "scenario_ids": [
        "normal"
      ],
      "rule_ids": [
        "EVT-001",
        "EVT-005",
        "EVT-006",
        "EXP-005",
        "EXP-012"
      ]
    },
    "boundary": {
      "scenario_ids": [
        "boundary"
      ],
      "rule_ids": [
        "EVT-001",
        "EVT-005",
        "EVT-006",
        "EXP-005",
        "EXP-012"
      ]
    },
    "failure": {
      "scenario_ids": [
        "failure"
      ],
      "rule_ids": [
        "EVT-001",
        "EVT-005",
        "EVT-006",
        "EXP-005",
        "EXP-012"
      ]
    }
  },
  "decimal_contract": {
    "id": "decimal-contract-v1",
    "max_significant_digits": 28,
    "max_scale": {
      "amount": 8,
      "quantity": 12,
      "unit_price": 12,
      "fx_rate": 15,
      "internal": 18
    }
  },
  "calculation_version": "ledger-calculation-v1",
  "policy_versions": {
    "expense": "expense-policy-v1",
    "bucket": "expense-bucket-policy-v1",
    "refund": "refund-policy-v1",
    "market_data": "market-data-policy-v1"
  },
  "rounding_boundaries": [
    "internal-scale-18-half-up",
    "display-currency-half-up"
  ],
  "tolerances": {
    "internal": "0",
    "display": "0.01"
  },
  "generation": {
    "method": "programmatically-generated-synthetic-data",
    "generator": "tools/generate-m0-fixtures.mjs",
    "reviewed": true
  },
  "canonical_hash": "sha256:58d409cea4822fdcbd044b7881d4ec9f55dd8dc32ce69f36b8c5547189a997f3"
}
